user_name,user_location,user_description,user_created,user_followers,user_friends,user_favourites,user_verified,date,text,hashtags,source,is_retweet,label,cleaned_text,sentiment,topic,misinformation_label
CouncilmemberKGR,,"Katherine Gilmore Richardson:
Wife, Mother, Councilwoman At-Large for the City of Philadelphia, #Masterman #GirlsHigh #WCU #ZPhiB",2020-01-09 15:49:29,1198,334,640,False,2020-08-18,.@PHLPublicHealth #covid19 testing map now offers filtered results for sites that are testing children. You can now… https://t.co/bweEm1SQr0,['covid19'],Twitter Web App,False,unverified claim,testing map offers filtered results sites children,POSITIVE,0,unverified claim
🏙🥂Carrie (Carol) Bell 🥂🌃,"Wentworth, Surrey","Champagne/EnglishSparkling/fine wine/fine dining blogger: Celebrated Property Professional/Liveryman; travel/sailing/rugby enthusiast, - WSET L2/3. Views my own",2011-08-11 15:35:56,765,1177,22154,False,2020-07-25,To those still thinking that their belief in their God and the power of prayer will save them from #COVID19 - it wo… https://t.co/TPSJIMAieB,['COVID19'],Twitter for iPad,False,unverified claim,still thinking belief god power prayer save wo,NEGATIVE,16,unverified claim
Brandon Johnson,"Somerville, NJ",Just ask me and I'll tell you. #TeamTop #Moonwalker,2009-04-28 01:47:27,82,186,980,False,2020-07-28,Let me say this to all you racist motherfuckers. Yes the virus originated in China but the technical term is… https://t.co/WZXnMmTLR2,,Twitter for iPhone,False,unverified claim,let say racist motherfuckers yes virus originated china technical term,NEGATIVE,12,unverified claim
Game Over Thirty,Earth!,In-depth game industry discussion. Inquires & requests go to joethreezero@gameoverthirty.com. YT - https://t.co/IPFbMxSlLK,2017-02-01 20:54:01,187,196,1236,False,2020-07-30,"Perhaps expected, #EA is rolling off an ""exceptional"" (their words) quarter. Engagement is up, revenue is up.… https://t.co/uXnNBWEyrq",['EA'],Twitter Web App,False,unverified claim,perhaps expected rolling exceptional words quarter engagement revenue,NEGATIVE,3,unverified claim
sakalmedia,"595, Budhwar Peth, Pune","Since 1932.
महाराष्ट्रतील नं. १ वृत्तपत्र 
Leading Marathi daily from Pune 🗞
News from Maharashtra & around the world 🌏",2009-10-26 12:47:27,155190,9,554,False,2020-07-25,"#COVID19 herd immunity will take time: #WHO's chief scientist

https://t.co/OmwhBCoSGE

#sakal #sakalmedia… https://t.co/R9GTAEhI6l","['COVID19', 'WHO', 'sakal', 'sakalmedia']",Hootsuite Inc.,False,unverified claim,herd immunity take time chief scientist,NEGATIVE,4,unverified claim
Yudah Naphtali #KBF,,Keep the world free,2018-04-04 12:58:26,134,220,2499,False,2020-08-22,"A clear part of the plan of UNAgenda21
Wealth transfer. Rich richer....Poor poorer. #TheGreatDeception #Covid19 https://t.co/JQDj7M1V87","['TheGreatDeception', 'Covid19']",Twitter Web App,False,unverified claim,clear part plan unagenda21 wealth transfer rich richer poor poorer,POSITIVE,3,unverified claim
Karen McBain,,"Après lui, le deluge. OG feminist, reinforcing your bias confirmation. Act the ass, and I will block you. F*ck Trump.",2013-06-13 17:45:26,1100,2079,191367,False,2020-08-04,"@realDonaldTrump showed more concern for Guislaine Maxwell than 1,000 dead Americans a day from #COVID19. #TrumpIsANationalDisgrace","['COVID19', 'TrumpIsANationalDisgrace']",Twitter for Android,False,unverified claim,showed concern guislaine maxwell 1 000 dead americans day,POSITIVE,13,unverified claim
Stefano Esposito,"Oslo, Norway","Trying to figure out what are the solutions to the structural problems of our time. Tweeting about inequality, economics, finance, agriculture, politics.",2011-12-04 13:39:24,288,985,432,False,2020-07-31,"""How #Italy has gone from being a global pariah to a model — however imperfect — of viral containment holds fresh l… https://t.co/mbdW1LcRbC",['Italy'],Twitter for Android,False,unverified claim,gone global pariah model however imperfect viral containment holds fresh l,NEGATIVE,12,unverified claim
RINewsToday,"Rhode Island, USA","https://t.co/GbyleAkSgo - Daily Rhode Island digital media - news, commentary, events & features. Send news/questions/tips: news@rinewstoday.com - (no other pages here)",2019-03-04 10:33:41,1038,2508,1400,False,2020-08-11,"The office visit - is a dinosaur - with contributing #health writer @RichardAsinof   @ConvergenceRI 
#healthcare… https://t.co/0Tfc1kUaAB","['health', 'healthcare']",Twitter Web App,False,unverified claim,office visit dinosaur contributing writer,POSITIVE,21,unverified claim
Mark Rachkevych,,"From Chicago. Seen in RFE/RL, The Ukrainian Weekly, the FT, @NYTimes, WSJ, IrishTimes, Kyiv Post, AP, & Bloomberg. Views are entirely my own.",2014-12-12 14:41:53,685,797,8859,False,2020-08-04,Six months to contain #COVID19 has gone done down the drain. Nothing has been done to contain this virus. Nothing t… https://t.co/8U1wmE34DY,['COVID19'],Twitter for iPhone,False,unverified claim,six months contain gone done drain nothing virus,NEGATIVE,12,unverified claim
Lucy Ortiz,New York,"Writer / Artist.....Some succeed because they're destined to, but most succeed because they're determined to.",2015-11-30 18:33:56,1783,794,156891,False,2020-08-01,This kid has more sense than the mask deniers. #COVID19 https://t.co/0VlGapNCcl,['COVID19'],Twitter Web App,False,unverified claim,kid sense mask deniers,NEGATIVE,9,unverified claim
Julio César Quila,,Q U I L A,2020-01-25 21:43:06,25,92,136,False,2020-08-09,"@RepJimmyGomez
Inequitable access to future #COVID19 vaccines would most affect our communities of color who have b… https://t.co/clF0WmRLc5",['COVID19'],Twitter for Android,False,unverified claim,inequitable access future vaccines would affect communities color b,POSITIVE,4,unverified claim
National Structural Integrity Research Centre,"Cambridge, England","NSIRC is a world leading postgraduate engineering facility founded by @TWI_Ltd, @LR_Foundation and @BP_plc",2013-04-08 08:29:29,351,267,675,False,2020-08-11,"Join @LR_Foundation for free on September 23rd, 13:00 BST (GMT +1)
.
&gt; https://t.co/OBvT2z5LJm 
.
#security… https://t.co/OcEP2ZPxOh",['security'],Twitter Web App,False,unverified claim,join free september 23rd 13 00 bst gmt 1 gt,POSITIVE,22,unverified claim
Dr. Sounds,"Lidköping, Sverige",Musician  creating soothing music. Now in commercial from @Hjarnfonden https://t.co/H0bhEBGMdF,2009-04-21 17:12:05,344,987,86,False,2020-08-02,"Sorry #COVID19, you arent the one pandemic. This is how it would sound if other ongoing pandemic was spelled in… https://t.co/KuedEA3vbd",['COVID19'],Twitter for Android,False,unverified claim,sorry arent one pandemic would sound ongoing spelled,NEGATIVE,2,unverified claim
Dundee Culture,"Made w/❤️ in Dundee, Scotland","Showcasing Dundee to the world & making Dundee's voice heard by promoting cultural news, stories, features and events from oor bonnie city! #DundeeIsOpen ❤",2013-09-06 21:00:17,8267,1331,5294,False,2020-07-31,🦄❤️ The @HMSUnicornship is now reopen after closing due to the #COVID19 pandemic! #DundeeIsOpen 🦄❤️ https://t.co/OVfnU8HU93,"['COVID19', 'DundeeIsOpen']",Twitter Web App,False,unverified claim,reopen closing due pandemic,NEGATIVE,1,unverified claim
Bride Rose Sweeney,"Cleveland, OH",Youngest Democrat in the Ohio General Assembly. First woman to ever represent my community at the Statehouse. Here’s to not waiting your turn 💪🏼,2018-11-14 21:21:02,1667,428,1010,True,2020-08-06,Prayers to our Governor @MikeDeWine . Let this be a reminder that no one is immune to #COVID19 #MasksOnOhio https://t.co/00jMrza6G3,"['COVID19', 'MasksOnOhio']",Twitter for iPhone,False,unverified claim,prayers governor let reminder one immune,NEGATIVE,16,unverified claim
eVantage Technology,Singapore,"eVantage Technology is a professional and trusted IT solutions provider, dedicated to providing exceptional service to companies in Singapore and across Asia.",2010-07-31 08:37:00,265,239,13,False,2020-08-17,#6: Look out for suspicious attachment names and file types. If the attachment is for something you have no recolle… https://t.co/8WEzxZkadY,,Buffer,False,unverified claim,look suspicious attachment names file types something recolle,NEGATIVE,12,unverified claim
HearMeRoar22,,Just saying it as it is!,2020-08-16 04:46:15,0,0,1,False,2020-08-16,People moaning about having to quarantine when coming back from France....you shouldn't have bloody gone in the fir… https://t.co/ej9PVJUlT6,,Twitter for Android,False,unverified claim,people moaning quarantine coming back france bloody gone fir,NEGATIVE,14,unverified claim
remote.io - Remote Jobs,Remote,"Remote / work-from-home jobs 👉 https://t.co/haAp0IcB5P 
Hiring remote employees? 👉 https://t.co/tRSrDANxMq",2019-06-09 18:20:48,2344,13,4,False,2020-08-22,"🚨 New Remote Job Listing 📢 
            
DevOps Engineer (AWS, Splunk Cloud) at Modus Create… https://t.co/8OewyeyTXd",,remote.io,False,unverified claim,new remote job listing devops engineer aws splunk cloud modus create,NEGATIVE,3,unverified claim
pere ciurana🌍,"Cambrils, Spain","Hunter-gatherer whose nation is Milky Way. Physicist, ITS and data scientist expert. Interested on  reason,quantum,irrationality,technology,data flows,religion",2017-10-04 06:45:01,67,125,1239,False,2020-07-26,"Censorship repeat with me: virus are simply excretions of toxic cells, virus are simply excretions of toxic cells,… https://t.co/WQF3yilFun",,Twitter for Android,False,unverified claim,censorship repeat virus simply excretions toxic cells,NEGATIVE,12,unverified claim
Jarrod J. Cain,,Why is this section so hard to fill out?,2014-04-22 19:40:21,25,63,237,False,2020-07-28,The CEOs are going rabid! @realDonaldTrump Please help us middle class hard and educated workers who are being laid… https://t.co/CZ0hgLASrj,,Twitter for Android,False,unverified claim,ceos going rabid please help us middle class hard educated workers laid,NEGATIVE,3,unverified claim
Lid MyZen.Blog 🥀☘️🇻🇬🌏,"Melbourne, Victoria, Australia","Global Lecturer/Tutor/Analyst & Adviser in International Bus, Optimist, Passionate Ozi, Blogger I share my poems, thoughts & passions. NO DIRECT MESSAGES",2010-05-15 10:04:56,2623,5001,2621,False,2020-08-13,#COVID19 Punishment for the teenager.....shhh do not tell him I ate the blue berries https://t.co/I7ag0AFpHl,['COVID19'],Twitter Web App,False,unverified claim,punishment teenager shhh tell ate blue berries,NEGATIVE,1,unverified claim
Dr Sarah Nadeem,"Karachi, Pakistan",Endocrinologist @akuglobal 🇵🇰Cancer survivor▫️Cofounder @pkwomeninmed▫️Trained @MayoClinic▫️#womeninmedicine #endotwitter #hormonehealth Opinions mine,2010-08-07 21:41:49,1986,1979,8901,False,2020-07-28,"Dr Uzma Siddiqui #pediatrician @AKUGlobal alumnus,talks about Safe Return to School in COVID Times… https://t.co/2cf0KtZjUQ",['pediatrician'],Twitter for iPhone,False,unverified claim,dr uzma siddiqui alumnus talks safe return school covid times,POSITIVE,1,unverified claim
Mercyposh_obby,"Lagos, Nigeria",an entrepreneur,2016-05-19 12:08:31,3,7,10,False,2020-07-29,"Dear money!
Social distance doesn’t concern you 
Please come closer to mama 
#COVID19 
#BBNaijia2020","['COVID19', 'BBNaijia2020']",Twitter for iPhone,False,unverified claim,dear money social distance concern please come closer mama,POSITIVE,11,unverified claim
TrainerLifeUnited,Canada,"Making Trainer Life a Good Life! The joys, the challenges, the gains, the journey. 💪📝⏱🔑",2020-07-07 23:23:38,27,168,1,False,2020-08-06,Gyms are reopening. There’s risk for those of us returning to work that we could become sick with #COVID19 due to b… https://t.co/Mwlrz1x13W,['COVID19'],Twitter for iPhone,False,unverified claim,gyms reopening risk us returning work could become sick due b,NEGATIVE,1,unverified claim
Robert Fairhead 📚🤔,"Sydney, Australia","#TallAndTrue tweets of #middleaged #dad and #dogowner. #Blogger, #writer, #editor at @TallAndTrueWeb. Also #dogtrainer! ❤️ #books #beingadad #dogs #SydneySwans",2011-08-18 23:56:46,1588,2243,24281,False,2020-08-09,"Just written 5th entry for @WritersCentreAU #furiousfiction #shortstory competition. Wrote 1st, A Song on the Radio… https://t.co/BNKaaAN9kN","['furiousfiction', 'shortstory']",Twitter Web App,False,unverified claim,written 5th entry competition wrote 1st song radio,POSITIVE,20,unverified claim
Resistance Princess 🌊🇵🇱👩‍⚕️😺🚀,"Santa Maria, CA",RN. Old fart. Cat lover. Proud geek. Potty Mouth. Democratic Socialist. Agnostic. MAGAts blocked. NO DMS! #Biden/Harris2020 #AmericaOrTrump #ETTD,2017-01-21 03:40:37,3866,5000,32450,False,2020-08-14,"It still pisses me off that a few weeks ago, Alex Azar had the nerve to stand at the podium during the WH coronavir… https://t.co/nr8SP3TKUO",,Twitter Web App,False,unverified claim,still pisses weeks ago alex azar nerve stand podium wh coronavir,NEGATIVE,5,unverified claim
Still Socially Distant Paul Maximilian Banks,"Gold Coast, Chicago, IL, USA",Web Content & Advertising Business Owner (link in bio) Author (pinned tweet) Sports Illustrated Writer. Artist. Fulbrighter. Swimmer. #BidenHarris #GGMU #Cubs,2008-08-20 05:38:33,3522,847,42242,True,2020-08-14,Notre Dame Begins Practice with #COVID and #SocialJustice Issues Looming Large https://t.co/gSVwUuVoDT… https://t.co/ob7uoESVyV,"['COVID', 'SocialJustice']",Twitter Web App,False,unverified claim,notre dame begins practice issues looming large,NEGATIVE,1,unverified claim
Open Letters,Text RESIST to 50409,"Copies of real letters delivered to the President, Congress, Governors, and State Legislators. Send 'resist' as a Direct Message to @resistbot to write yours.",2017-12-06 22:18:07,17341,3,2,True,2020-08-16,"🖋 Sign “Please Safeguard Our Elections” and I’ll deliver a copy to your officials: https://t.co/vdc78HChqE

📨 No. 4… https://t.co/5PRlmU1yGl",,Resistbot Open Letters,False,unverified claim,sign please safeguard elections deliver copy officials 4,NEGATIVE,15,unverified claim
TalkShoe,"Toronto, Ontario","Create, publish & host your podcast FREE on https://t.co/G1lgQCfkO9 with tons of cool features. Book FREE recording time at our studio in @stacktmarket: https://t.co/4KVW743e3N",2007-04-14 19:49:21,7258,6810,7622,False,2020-07-31,"Start your new podcast with the Talkshoe platform, your #FREE online #recording studio. Sign up and check out how q… https://t.co/l9WrvmMUXA","['FREE', 'recording']",Buffer,False,unverified claim,start new podcast talkshoe platform online studio sign check q,POSITIVE,19,unverified claim
Shinil Payamal,"Pune, India","I am a Director at MarkoMon Impex Pvt. Ltd., an E-commerce company.",2008-06-24 21:03:54,3867,1057,265416,False,2020-08-11,"#Russia approves first #COVID19vaccine💉for use, Putin says his daughter inoculated
https://t.co/ZOEqsm4oXR… https://t.co/GeYF9rBlTB","['Russia', 'COVID19vaccine']",Twitter Web App,False,unverified claim,approves first use putin says daughter inoculated,NEGATIVE,4,unverified claim
SuburbanHousewife AGAINSTTRUMP mama,USA🗽,proud libtard w opinions no one pays attention🙋🏻‍♀️ potty mouth🤬 MemeStealer⚠️ #TheResistance #StillWithHer✨#FollowBack #FBR💕followed by lotsa cool people😇,2012-01-29 01:16:32,12131,11085,35006,False,2020-08-18,"over 170,000 americans have died NEEDLESSLY from #COVID19. many MORE will follow.🥺

trump:  I DON’T LIKE HAVING THO… https://t.co/5atRmjEJua",['COVID19'],Twitter for iPad,False,unverified claim,170 000 americans died needlessly many follow trump like tho,NEGATIVE,13,unverified claim
Tony,United States,Old retired libertarian scientist who is worried about the collapse of our society.,2020-03-11 19:05:40,18,19,57,False,2020-08-08,@WSJ The dearth of African-American representation in the #COVID19 vaccine trials will further contribute to the al… https://t.co/PIyUUag3V7,['COVID19'],Twitter for iPhone,False,unverified claim,dearth african american representation vaccine trials contribute al,NEGATIVE,4,unverified claim
PEP ⚒️ ⚖️ 🕊️ ♥️,🇬🇧 🇫🇷 🇳🇱 ,"#Love #Truth #Freedom & #Justice . #Art & #Creativity . A comfort zone is a beautiful place,but nothing ever grows there.",2012-05-28 19:33:20,1503,1327,17650,False,2020-08-01,"Rather like #9/11 #WMD s &amp; #COVID19 . Once the media control the narrative, they control the minds of millions . https://t.co/8w9Ed1O6Ne","['WMD', 'COVID19']",Twitter Web App,False,unverified claim,rather like 11 amp media control narrative minds millions,NEGATIVE,6,unverified claim
FetchYourNews.com,"Ellijay, GA","Proudly serving as the top news source for Fannin, Gilmer, Pickens, White, Lumpkin,  Dawson, Union, Towns, Murray and Cherokee County NC.",2010-06-04 17:06:10,2200,868,318,False,2020-08-06,"What's considered dangerous for us now? Cash is considered dirty, so we can't give change. In this cashless society… https://t.co/GvssUlf66m",,CoSchedule,False,unverified claim,considered dangerous us cash dirty give change cashless society,NEGATIVE,3,unverified claim
Golden Nugget,"Houston, TX",One day at a time in this doggy dog world! :) 🐶💯🌊✌🏾❤️😎,2018-08-10 06:20:30,690,4901,131575,False,2020-08-01,"@realDonaldTrump Golf in the morning, and tweeting in the afternoons... Must be nice!

Meanwhile over 150k lives lo… https://t.co/8zZBp2H8K9",,Twitter for Android,False,unverified claim,golf morning tweeting afternoons must nice meanwhile 150k lives lo,POSITIVE,11,unverified claim
Remedazo,"New Delhi, India","A medical tourism company that combines compassion, the finest quality of care, and complete security.",2018-10-10 13:35:21,1380,124,158,False,2020-07-28,"To book Antibody Test for you or your loved ones use the details provided in below creative.(4/4)

#COVIDー19… https://t.co/9ymlKMKBWy",['COVIDー19'],Twitter Web App,False,unverified claim,book antibody test loved ones use details provided creative 4,POSITIVE,0,unverified claim
Ms. Net,,"We must dump Trump, need BlueWave voters!! Trump so scared of my tweets he blocked me, despite law saying his twitter used officially so he can’t block!",2009-02-22 02:49:30,3850,3886,79154,False,2020-08-02,@RabbiJill @sherrilee7 @USPS Meet the nightmare installed as @POTUS that explains why America is being destroyed &amp;… https://t.co/B0ADxZLBJv,,Twitter for iPhone,False,unverified claim,meet nightmare installed explains america destroyed amp,NEGATIVE,6,unverified claim
Yonas Sbhat K.,Ethiopia,"A Proud Ethiopian Father 🇪🇹|Husband|Brother|Human|Logical but can't tolerate illogical, selfish and racist act of people at all..!",2012-05-28 17:56:40,350,1777,6381,False,2020-08-06,"And this...?!

They will probably end up in one of the #COVID19 quarantine centers as #COVID19 is used for illegal… https://t.co/6czIweUU4y","['COVID19', 'COVID19']",Twitter for Android,False,unverified claim,probably end one quarantine centers used illegal,NEGATIVE,14,unverified claim
Thebengalurulive,,"A web based news portal which intends to provide tiny information related to Bengaluru..we are online since February 27, 2020

Write: thebengalurulive@gmail.com",2020-02-27 06:40:49,63,65,146,False,2020-07-25,"Villagers to boycott 'delayed result' Covid tests

https://t.co/vgSdzUyeSA

#CHIKKAMAGALUR #Covid #test #Kalasa… https://t.co/0ZcJS1Z39I","['CHIKKAMAGALUR', 'Covid', 'test', 'Kalasa']",Twitter for Android,False,unverified claim,villagers boycott delayed result covid tests,NEGATIVE,0,unverified claim
Jameson Voss MD MPH,"Washington, DC","Preventive Medicine physician in US Air Force; adjunct USU; #Covid19, precision medicine, obesity, biotech; all opinions my own",2012-03-16 03:15:06,5566,4943,2667,False,2020-08-30,More testing is not necessarily better testing and harms can cascade with contact tracing.  The problem with persis… https://t.co/mC8yaVbZEK,,Twitter Web App,False,unverified claim,testing necessarily better harms cascade contact tracing problem persis,NEGATIVE,0,unverified claim
Alexxis,Here there,Smile.🙂.,2011-03-23 04:41:24,10083,11082,73747,False,2020-08-14,@DrTedros @WHO @UNICEF Call on governments to shutdown schools during the #COVID19 pandemic!,['COVID19'],Twitter Web App,False,unverified claim,call governments shutdown schools pandemic,NEGATIVE,1,unverified claim
KJN,"Arizona, USA",Humbled by & loyal to my #BIDEN followers!! 💙 #FBR #TheResistance #NEVERaTRUMPER #Resister #TrumpLiesPeopleDie #VOTEBLUE #BIDEN2020 #FUCKCANCER. #LGBTQ🏳️‍🌈,2019-08-16 00:52:23,671,1428,12179,False,2020-08-01,Shut up and golf #TraitorTrump  your are not a leader @potus we have #Covid19 to deal with rhe #TrumpVirus all than… https://t.co/DXpLl0nxsh,"['TraitorTrump', 'Covid19', 'TrumpVirus']",Twitter for iPhone,False,unverified claim,shut golf leader deal rhe,NEGATIVE,11,unverified claim
(((thetimewall.com)),"Dunedin, FL USA","If you have been wondering where this #Scamdemic is headed. 
World Economic Forum | THE GREAT RESET - 2021 with Prince Charles 
#filmyourhospital",2016-11-29 23:04:46,440,84,307,False,2020-07-31,"the enemies within 
The Rockefeller Foundations and Non-Profits, and ilk. 
Burn Witch Burn.. Burn Witch Burn. And S… https://t.co/s7l086QUL6",,Twitter Web App,False,unverified claim,enemies within rockefeller foundations non profits ilk burn witch,NEGATIVE,3,unverified claim
Hill's Handmades,,"maker of beautiful, hand-crocheted, cruelty-free accessories 
#Vegan #DogGuardian #Patriot #ResistTyranny #Vote 🇺🇸",2015-07-01 03:32:59,412,966,16208,False,2020-08-14,"170,415 dead Americans. This is what genocide looks like. Shitler @POTUS @realDonaldTrump is going NOTHING to tackl… https://t.co/w24XFYckSG",,Twitter for Android,False,unverified claim,170 415 dead americans genocide looks like shitler going nothing tackl,NEGATIVE,13,unverified claim
Wanderer,,Skeptically curious,2015-04-04 19:56:09,120,996,12325,False,2020-08-30,"Kamala Harris - “There is no vaccine for racism. However COVID-19 is racist”

""While this virus touches us all, we… https://t.co/qISUAin2qH",,Twitter for Android,False,unverified claim,kamala harris vaccine racism however covid 19 racist virus touches us,POSITIVE,4,unverified claim
Robson,,"Professor of Law.  Writer.
Books include Dressing Constitutionally; Sappho Goes to Law School; A/K/A",2011-06-20 14:24:11,1239,931,28945,False,2020-08-13,"@SenRickScott Hello? #COVID19 Senator. What are you doing?
https://t.co/vNmX0caHHX",['COVID19'],Twitter for iPad,False,unverified claim,hello senator,POSITIVE,15,unverified claim
MuniGUARDNews,,,2013-12-17 19:33:54,569,232,159,False,2020-08-14,"A $400 #unemployment extension is unlikely to arrive soon, if at all. What you need to know #muniland #Americans… https://t.co/ox6MRhoLD6","['unemployment', 'muniland', 'Americans']",Twitter Web App,False,unverified claim,400 extension unlikely arrive soon need know,NEGATIVE,22,unverified claim
Solomon Ambuku,"Mombasa, Kenya.",Social Democrat | Governance & Human Rights Crusader | Political Analyst | U.S. Democracy Scholarship 1999 alumnus | Envinromentalist | Proverbs 31: 8-9,2014-04-23 21:22:36,36310,37949,133314,False,2020-08-01,"@ntvkenya @OBurrows Quarantine not necessary for Chinkos from the craddle of the #COVID19 in #Wuhan , #China. Only… https://t.co/nbPPDqnxLy","['COVID19', 'Wuhan', 'China']",Twitter for Android,False,unverified claim,quarantine necessary chinkos craddle,NEGATIVE,14,unverified claim
I DigiPlex Infotech,"chomu , India",Welcome to  I DigiPlex Infotech !! We increase your valuable business's presence on search engine with respective reputation level. Start work today with us.!!!,2020-08-13 17:06:49,0,32,0,False,2020-08-16,Why #covid19 is affecting #digitalmarketing work ? @GoogleIndia @sundarpichai,"['covid19', 'digitalmarketing']",Twitter Web App,False,unverified claim,affecting work,POSITIVE,3,unverified claim
EWN Lifestyle,"Johannesburg, South Africa","Bringing you all the latest in local and international fashion, entertainment, celebrities, food and more!",2018-09-07 14:31:41,751,248,16,False,2020-08-13,Pandemic behaviour: Why some people don't play by the rules #COVID19 https://t.co/FGnju2MLVB https://t.co/AjB4WG7W7s,['COVID19'],dlvr.it,False,unverified claim,pandemic behaviour people play rules,NEGATIVE,2,unverified claim
Abdulkadir Nasidi,"Abuja, Nigeria. ","#Energy Entreprenure|#Leadership|
#Founder/CEO, @Carvenservice |#BDSP|#Wannem shina Nne uzo|#Eko oni Baje♡|",2013-09-18 20:02:54,3662,3583,130689,False,2020-08-11,"#SchoolsMustShutdown
If schools remain closed much longer, eventually parents will have to invent the #COVID19 vacc… https://t.co/k9fJ8CuYMs","['SchoolsMustShutdown', 'COVID19']",Twitter for Android,False,unverified claim,schools remain closed much longer eventually parents invent vacc,NEGATIVE,1,unverified claim
JuneBug,Internet,Democracy means counting all ballots.  I'm about common decency.  If you are a racist please don't follow me.  Power To The People!!,2010-03-25 22:12:13,173,455,21524,False,2020-08-01,#Politicians should #stop #sleeping in their #office it's unhygienic  especially during #COVID19 putting their #STAFF at #risk,"['Politicians', 'stop', 'sleeping', 'office', 'COVID19', 'STAFF', 'risk']",Twitter Web App,False,unverified claim,unhygienic especially putting,NEGATIVE,18,unverified claim
DGTL Innovations,Mumbai,DGTL Innovations is an Management Consulting and Digital Transformation company which empowers modern businesses with cutting-edge innovative & cloud solutions,2017-04-19 13:52:52,14,24,4,False,2020-08-06,"#covid19 #newnormal #lifeaftercovid19 #positivityiskey 
In these times, DGTL sends a message of positivity &amp; Hope f… https://t.co/SduaBlKRrz","['covid19', 'newnormal', 'lifeaftercovid19', 'positivityiskey']",Zoho Social,False,unverified claim,times dgtl sends message positivity amp hope f,NEGATIVE,6,unverified claim
