user_name,user_location,user_description,user_created,user_followers,user_friends,user_favourites,user_verified,date,text,hashtags,source,is_retweet,label,cleaned_text,sentiment,topic,misinformation_label
Matthew Austin,"Sydney, New South Wales",'A nation of sheep will beget a government of wolves' - Ed R Murrow.,2018-10-28 21:39:00,1431,1329,35679,False,2020-08-30,"Seems to me the big 'Left Wing' twitter accounts are either hostile to challengers of #coronavirus narrative, or st… https://t.co/IL73pI9i0k",['coronavirus'],Twitter for Android,False,unverified claim,seems big left wing twitter accounts either hostile challengers narrative st,NEGATIVE,11,unverified claim
"Fancy Comma, LLC",,We are a team of professional freelance writers & editors with 20+ years of cumulative writing experience. Find us on the web at https://t.co/ZNbeXW0UDk.,2020-04-08 23:45:28,402,652,1305,False,2020-07-26,@CoronaStocks @Novavax Curious investors can read about how the $NVAX vaccine works on our blog:… https://t.co/OECsBjDtuQ,,Twitter Web App,False,unverified claim,curious investors read nvax vaccine works blog,POSITIVE,4,unverified claim
ShonJohn 47,"Washington, USA","Streamer, youtuber and Friend #ShonJohn47 #Streamer #Youtuber",2019-07-30 07:21:11,1,1,63,False,2020-08-22,Cuisine royale my first game in a long time haven't played for months so sorry if I suck i was just trying to have… https://t.co/OlFrOYYptQ,,Twitter for Android,False,unverified claim,cuisine royale first game long time played months sorry suck trying,NEGATIVE,11,unverified claim
iCanSaveLife,India,We try to bridge the gap between Blood donor & patient in emergency. For Blood requirement Anywhere in #India tweet with  #iCanSaveLife,2010-01-04 19:57:40,47374,9542,3357,False,2020-08-11,"#Hyderabad #Aug11
Need Plasma from A+ve #COVID19 recovered patient. 
At KIMS Hospital
Call 8008590169
via @ cc… https://t.co/AY4ncdxgGq","['Hyderabad', 'Aug11', 'COVID19']",Twitter Web App,False,unverified claim,need plasma recovered patient kims hospital call 8008590169 via cc,NEGATIVE,0,unverified claim
Jo Worf,"Mainz-Bingen, Rheinland-Pfalz","#DellEMC Global Customer Success Lead, EdServices #DellEMCElect 2017, #Iwork4Dell, #CEdMA Board|Love playing tennis. Member of FSV #Mainz05.Tweets are my own...",2013-06-20 15:29:38,556,802,3719,False,2020-08-18,Interesting company with many more potential products outside of the #COVID19 discussions. #BionTech #Biotechnology https://t.co/yslylSlcA3,"['COVID19', 'BionTech', 'Biotechnology']",Twitter for Android,False,unverified claim,interesting company many potential products outside discussions,POSITIVE,3,unverified claim
Ashley Clark Whitman,"Hamilton, GA",#Truth telling #Conservative! Followed by @cvpayne @RealDrGina @Harlan @GinaBrunson ❤️ #Trump 💕 #GodBlessTheUSA 🇺🇸#IStandWithIsrael 🇮🇱#GodSaveTheQueen 🇬🇧,2016-06-13 15:13:25,1771,2179,19701,False,2020-07-28,@JeffAronson25 @DavidRoths @Lentils4Mentals @Donald_from_HI @realDerekUtley @BreitbartNews I have a friend who has… https://t.co/xCXmperXag,,Twitter for iPhone,False,unverified claim,friend,POSITIVE,10,unverified claim
Kathryn Booth,Dorset,"Ex Book PublisherDesigner, NEU School Rep, NEU Dorset Support Staff Officer, District & Branch Secretary, National Support Staff Council, past ATL Exec.",2010-01-06 16:42:56,692,906,5503,False,2020-08-22,Tell US pharma company @moderna_tx: No profiteering from #Covid19 vaccines - via @GlobalJusticeUK https://t.co/uFbnfFGTWj,['Covid19'],Twitter for iPhone,False,unverified claim,tell us pharma company profiteering vaccines via,NEGATIVE,4,unverified claim
BBC Radio 5 Live,"Salford, United Kingdom",The @BBC's home of breaking news and sport: where stories come to life. Tweet @bbc5live to contact the studio directly. Listen on @BBCSounds.,2007-07-19 16:30:09,670039,17997,2363,True,2020-07-28,"🗣️ ‘We think the future is not about massive lockdowns…’

@WHO Special Envoy on #COVID19, Dr @DavidNabarro talks to… https://t.co/FnN8Wa2o4U",['COVID19'],Twitter Media Studio - LiveCut,False,unverified claim,think future massive lockdowns special envoy dr talks,NEGATIVE,2,unverified claim
Noah Woodard😆,"McDonough, GA",Young athlete from GA🙌 ELHS🦅 Class of 2023 Football DE and LB,2020-01-05 07:43:37,0,53,47,False,2020-07-28,"I just want to strap up and go back on the field but people don’t wanna put there mask on,think about the people wh… https://t.co/PKTFOLqcuL",,Twitter for iPhone,False,unverified claim,want strap go back field people wan na put mask think wh,NEGATIVE,9,unverified claim
Yvonne Spiczynski,the T-Dot,378 gigs since Jan 2014. the Toronto Reflektor. Halfway+ to visiting at least one country for every letter of the alphabet.,2012-02-25 19:49:54,495,290,117091,False,2020-08-17,People who think masks don’t cut down chances of transmission of the coronavirus are utterly fascinating to me.… https://t.co/JM7WsdBYii,,Twitter for iPhone,False,unverified claim,people think masks cut chances transmission coronavirus utterly fascinating,POSITIVE,9,unverified claim
Rob Wright,"Erie, PA","As chief editor of Life Science #Leader magazine, I write about BioPharma Execs, #Innovation & #Leadership, but as a father & husband I tweet about everything.",2010-11-23 18:21:54,7245,102,7333,False,2020-08-10,Who Chooses the Choosers? — Ethical Considerations For Distribution Of #COVID19 Vaccines https://t.co/D3veyqTxqy… https://t.co/VZxzZgB9At,['COVID19'],Twitter Web App,False,unverified claim,chooses choosers ethical considerations distribution vaccines,NEGATIVE,4,unverified claim
Michael Gendron,Ottawa,"Dad, GR & Comms - Cdn Police Association, fmr Grit hill staffer, skip of dysfunctional curling team, bad golfer, foremost Canadian Orioles fan, median voter.",2009-07-21 14:21:10,2580,1628,11293,False,2020-07-31,"FYI - If you downloaded the Beta test of the GoC #COVID19 app, note that you have to uninstall that one and downloa… https://t.co/iui5w5pWeL",['COVID19'],Twitter Web App,False,unverified claim,fyi downloaded beta test goc app note uninstall one downloa,NEGATIVE,19,unverified claim
Skittery Winter ex Karen 🏴󠁧󠁢󠁳󠁣󠁴󠁿❤🇪🇺😷,Due North,"A girl, some gear and half an idea. I do like a G&T.",2016-08-09 15:51:39,489,279,227217,False,2020-08-12,@combat_boot Alas not. Ours at set at the start &amp; our fascist overlords try &amp; make use of the 6 month review to pus… https://t.co/3LesMncMoE,,Twitter for Android,False,unverified claim,alas set start amp fascist overlords try make use 6 month review pus,NEGATIVE,6,unverified claim
Thinkers360,United States,Connecting global #brands with the world’s foremost #thoughtleaders & authentic #influencers on #business & #tech for game-changing results. Sign-up for free!,2017-10-13 21:24:02,5279,5280,7045,False,2020-07-26,COVID-19s Counter-Intuitive Implications for Small Business and Employment https://t.co/0iK24vFo17 via @tkspeaks on… https://t.co/xcm4HwD7xe,,Buffer,False,unverified claim,covid 19s counter intuitive implications small business employment via,POSITIVE,3,unverified claim
Musafir Namah,"New York, US & Delhi, India","Latest tourism news, views, policy, information, travel tips, inspiration and ideas about India and all that is Indian globally.",2014-06-04 17:49:44,2989,485,1877,False,2020-07-28,"#CoronaVirusus Washington mayor says visitors from 27 “high-risk” states must quarantine for two weeks, reports AFP… https://t.co/zgoPlWXWRD",['CoronaVirusus'],Twitter Web App,False,unverified claim,washington mayor says visitors 27 high risk states must quarantine two weeks reports afp,NEGATIVE,14,unverified claim
Archana Shukla,Mumbai,"Associate Editor - Rural Affairs, Healthcare @cnbctv18
Enchanted by village life.
#RamnathGoenkaAward 2016 #RedInkAwards 2017, 2019 #CJEA 2018",2008-12-30 08:26:08,3182,339,3244,False,2020-08-02,Don't know whether to feel scared or angry. It's an opinion piece &amp; I hope this opinion doesn't catch on. Science m… https://t.co/7EnYK5GDlc,,Twitter for Android,False,unverified claim,know whether feel scared angry opinion piece amp hope catch science,NEGATIVE,21,unverified claim
Mike ward,Nottinghamshire,"Asthma, COPD & bronchiectasis. Also change in NHS culture to integrate care for the patient. For evidence analysis and stats in all things. World citizen.",2013-06-15 20:40:38,810,679,2747,False,2020-08-14,UK school-leavers predictably let down by #GovernmentShambles ministers not fit for office. Consistently bad… https://t.co/0m06ahwmpT,['GovernmentShambles'],Twitter Web App,False,unverified claim,uk school leavers predictably let ministers fit office consistently bad,NEGATIVE,1,unverified claim
🔥 Anne Carlin,Gold Coast,"To see a World in a Grain of Sand and a Heaven in a Wild Flower, hold Infinity in the palm of your hand and Eternity in an hour.  Auguries of Innocence: W.Blake",2013-09-24 04:00:01,5797,2720,31564,False,2020-08-12,All should follow Rick's tweets #AgedCareRC. The response of federal &amp; state agencies responsible 4 #AgedCare… https://t.co/iW8gkplTfr,"['AgedCareRC', 'AgedCare']",Twitter for Android,False,unverified claim,follow rick tweets response federal amp state agencies responsible 4,NEGATIVE,6,unverified claim
FogBelter,"Cobweb Palace, San Francisco",~To Fight is to Win~,2008-06-13 05:05:25,1551,3160,36885,False,2020-08-02,"It’s not like he killed 150,000 Americans ... just saying. 

#COVID19 https://t.co/o8MJ1XwdQd",['COVID19'],Twitter for iPhone,False,unverified claim,like killed 150 000 americans saying,NEGATIVE,13,unverified claim
Louise Starkey,"Sydney, New South Wales",Online News Reporter @DailyMailAU in Sydney | Got a yarn? Email louise.starkey@mailonline.com,2016-06-17 06:51:21,207,768,422,True,2020-08-04,Guns and bullets are flying off shelves almost as fast as toilet paper and hand sanitiser as the coronavirus turns… https://t.co/XQZymMbw5f,,Twitter Web App,False,unverified claim,guns bullets flying shelves almost fast toilet paper hand sanitiser coronavirus turns,NEGATIVE,5,unverified claim
Robert Evans,,"Husband, Father of two beautiful daughters, Proud American, Financial Planner, Golfer, Part time sax player, jazz man",2019-09-29 23:35:48,34,882,442,False,2020-08-18,We are in the middle of a #COVID19 PANDEMIC and @FoxNews @OutnumberedFNC are criticizing the DNC CONVENTION but doe… https://t.co/2pg4Ri3yMN,['COVID19'],Twitter for Android,False,unverified claim,middle pandemic criticizing dnc convention doe,NEGATIVE,2,unverified claim
🇺🇸 Grenni 🇮🇱,"Tennessee, USA","Jack-of-all-trades. Mom. Retired IT, US Army Veteran - My Oath never expires. Sweet, until I'm not. ✡️GERE - #AmYsraelChai - #Boomer #MAGA2020 - 🚫Trains.",2016-10-07 07:43:21,21541,15003,37837,False,2020-07-28,"@Twitter &amp; Facebook are complicit for censoring the #WhiteCoatSummit  videos.

Those who lost loved ones, job, busi… https://t.co/Mny3YNOzyQ",['WhiteCoatSummit'],Twitter for iPhone,False,unverified claim,amp facebook complicit censoring videos lost loved ones job busi,NEGATIVE,11,unverified claim
Edinburgh Medical School,Edinburgh,"Part of the University of Edinburgh. Sharing news and events from across the Edinburgh Medical School community.
Office hours: 9am-5pm Mon-Fri.",2010-08-24 14:59:43,5467,467,575,False,2020-08-11,Prof Raj Bhopal @EdinUniUsher argues that population immunity is the long term solution to #COVID19 and calls for u… https://t.co/ryz7zeWqsQ,['COVID19'],Twitter Web App,False,unverified claim,prof raj bhopal argues population immunity long term solution calls u,NEGATIVE,4,unverified claim
Say NO - UNiTE,Global,"Say NO – UNiTE to End Violence against Women records what individuals, orgs & govts worldwide are doing to end violence against women. Managed by @UN_Women.",2009-10-21 16:52:43,94420,1877,672,True,2020-08-01,"Since the outbreak of #COVID19, reports of domestic violence have increased and intensified. If you are living with… https://t.co/Lue2410XcD",['COVID19'],Hootsuite Inc.,False,unverified claim,since outbreak reports domestic violence increased intensified living,POSITIVE,12,unverified claim
HQInnovators,,"HQI equips health care providers in every care setting with tools, training & support for quality improvement.",2019-12-06 17:39:16,23,83,17,False,2020-08-06,"MT @Health_Affairs: #COVID19 may impact #flu vaccination rates. @advncdhindsight's @drjenna_clark says, If we want… https://t.co/y3IVliYIPb","['COVID19', 'flu']",Hootsuite Inc.,False,unverified claim,mt may impact vaccination rates says want,NEGATIVE,4,unverified claim
Binoy Simon Mathews,,"FOR BEAUTIFUL EYES, LOOK FOR THE GOOD IN OTHERS, FOR BEAUTIFUL LIPS, SPEAK ONLY WORDS OF KINDNESS, AND FOR POISE, WALK WITH KNOWLEDGE THAT YOU ARE NEVER ALONE.",2015-04-17 03:56:14,150,197,27455,False,2020-07-25,@UN @UNHumanRights world leaders did u ever noticed any where in d world a patient testing himself for #covid19 in… https://t.co/TayliDdkqN,['covid19'],Twitter for Android,False,unverified claim,world leaders u ever noticed patient testing,POSITIVE,0,unverified claim
Angela Paladino,"Melbourne, Victoria","Professor of Marketing, Unimelb (innovation, environmental mktg, attitudes; business education); Director, WCLA; Former A/Editor Jour. Product Innovation M'ment",2015-12-22 05:37:41,434,484,1762,False,2020-08-22,Social #innovation #coronavirus #COVID19 https://t.co/ExVOyC5nKg,"['innovation', 'coronavirus', 'COVID19']",Twitter for Android,False,unverified claim,social,POSITIVE,11,unverified claim
✞湘南風✞,神奈川県茅ヶ崎市南湖,反日反社会的思想が大嫌い… 中国共産党とか北朝鮮とか韓国とか創価学会とかね。反日コリアン系日本人に注意！！！ 中韓朝創価批判でたまにロックされます。 ✞湘南風2✞ は別アカウント。,2011-02-25 12:51:03,1232,1154,238,False,2020-08-16,"Joe Biden and Moon Jae-in are dementia. The Chinese Communist Party loves both.
The perverts gather in the same pla… https://t.co/gaNktf8KDe",,Twitter for iPhone,False,unverified claim,joe biden moon jae dementia chinese communist party loves perverts gather pla,NEGATIVE,9,unverified claim
Ra Sun,,,2017-04-09 01:29:06,12,91,70,False,2020-07-27,@TrumpWarRoom @realDonaldTrump @ErinMPerrine Trump doesn't care about your health or the health of your children.… https://t.co/dhzkngrGao,,Twitter Web App,False,unverified claim,trump care health children,POSITIVE,1,unverified claim
Jaideep Pandey,नई दिल्ली.. लखनऊ से via नोएडा,"Independent Journalist | Politico-Legal Observer |
Words in @DeccanHerald, @NewIndianXpress
""आज यहाँ, कल कहाँ कूच है, कौन जानता, किधर सवेरा""
RTs ≠ Endorsements",2012-03-30 05:52:06,3264,199,8388,False,2020-07-25,"#Srinagar #URGENT #Verified 
Need B+ #blood #plasma of a #COVID19 recovered person at SKIMS, Soura. Call: 941900454… https://t.co/nw8n19VkSp","['Srinagar', 'URGENT', 'Verified', 'blood', 'plasma', 'COVID19']",Twitter Web App,False,unverified claim,need b recovered person skims soura call 941900454,NEGATIVE,0,unverified claim
Larry MacDonald,Canada,"West Coast/Vancouver Dude, Background in I.T., Content Creator, Mainframe Warrior, Creator of the Legendary 'Jeff Beck's Guitar Shop' Website.",2012-04-13 19:06:08,156,274,53,False,2020-07-29,"Team USA 🇺🇸 Musical Interlude: Hydroxychloroquine, sex with Demons while dreaming, alien DNA infused medicine #Whoa… https://t.co/57OCJvsB2B",['Whoa'],Twitter for iPhone,False,unverified claim,team usa musical interlude hydroxychloroquine sex demons dreaming alien dna infused medicine,NEGATIVE,20,unverified claim
Ruthiehot,Nigeria,"Social Media Influencer! 

Customer Care Support  @pas_solar LTD

Renewable energy advocate ☀ 🏡 Join #TheSolarRevolution",2017-03-11 18:36:27,221,853,4742,False,2020-07-25,Why do I feel like the Pandemic will vanish after the US elections in November? 🤔 #COVID19 #bbnaijalockdown2020 #COVID19Nigeria,"['COVID19', 'bbnaijalockdown2020', 'COVID19Nigeria']",Twitter for Android,False,unverified claim,feel like pandemic vanish us elections november,NEGATIVE,2,unverified claim
Jim McLaughlin,Glasgow,"Happily retired, two daughters,four grandchildren,one dog and one wife.",2011-02-10 13:24:15,79,83,1343,False,2020-08-11,The Boli story beggars belief!Some serious questions have to be answered. Did Celtic know he was in Spain?Presumabl… https://t.co/HiWgbIewGl,,Twitter for Android,False,unverified claim,boli story beggars belief serious questions answered celtic know spain presumabl,NEGATIVE,14,unverified claim
Md Salim,"Kolkata, West Bengal",Marxist. Politburo Member-CPI(M). Served Rajya Sabha for 2 terms. Ex MP Raiganj & Calcutta NE. Ex Youth Affairs & Minority Development Minister West Bengal.,2011-06-06 13:03:50,53171,222,11033,True,2020-08-30,The situation in the state would have been much better if our CM had kept her petty politics aside &amp; had introduced… https://t.co/2weVqBcUyI,,Twitter for iPhone,False,unverified claim,situation state would much better cm kept petty politics aside amp introduced,NEGATIVE,6,unverified claim
BRANDON ⚖️,PNW → PA → DC,National Press Secretary @DemocraticAGs | Alum: @GSPMgwu & @willamette_u | Seattle Sports | @JoslinSchultz’s lesser half | he/him | tweets = mine,2012-10-07 02:59:22,2819,1156,224172,True,2020-08-29,"How is he failing to keep people safe?

1) Said it’s ok for religious schools to re-open without #COVID19 safety pr… https://t.co/F2vdJhFx43",['COVID19'],Twitter for iPhone,False,unverified claim,failing keep people safe 1 said ok religious schools open without safety pr,NEGATIVE,1,unverified claim
john P.,hell,"social worker democrat  #resist #resist #Resistance #DefundThepolice #icantbreathe
#JusticeForFloyd #TheResistance  #MoscowMitch #WhiteSupremacist  #FBR",2018-03-09 16:23:24,3213,4178,16511,False,2020-07-25,our friend and the great #Resister @danielascholz7 going to the ER now fighting Covid-19 please keep her in your th… https://t.co/O81vzOLEgD,['Resister'],Twitter Web App,False,unverified claim,friend great going er fighting covid 19 please keep th,POSITIVE,17,unverified claim
malta,,Producer of fine food,2012-10-25 03:21:55,668,58,70604,False,2020-08-08,@DrJacobsRad If we need a randomized controlled study on HCQ before people are to be allowed to choose it for a tre… https://t.co/bhi3FnZOPt,,Twitter Web App,False,unverified claim,need randomized controlled study hcq people allowed choose tre,NEGATIVE,0,unverified claim
Rimah Harb,,#AI #Technology #Entrepreneur #startups #IoT #Robots - Linkedin: https://t.co/92yZF1WlFN,2012-10-16 08:34:28,8549,4843,2042,False,2020-08-17,"Asia bets on blockchain to battle online theft during pandemic https://t.co/HLdTwbkkaf 

#blockchain #onlinetheft… https://t.co/inlspU1xA8","['blockchain', 'onlinetheft']",Twitter Web App,False,unverified claim,asia bets blockchain battle online theft pandemic,NEGATIVE,3,unverified claim
Tainted Buddah Recs,Catalonia,"ALWAYS TAINTED BUDDHA IT'S ON YOUR BODY (dancing), MIND(feeling) AND SOUL(relax)-
 if you followme and later removeme, i remove&block you.",2011-01-19 21:27:59,2742,2751,16,False,2020-08-29,"😻😘😜😍🔊🔉🔊🔉👍🚨🐛🐲🐸
on Air NOW!!! 
The Tainted Guide 99,2 FM Barcelona
https://t.co/AcsTzB8re3
With Tainted Jaycee!!… https://t.co/gqQzrmayud",,Postcron App,False,unverified claim,air tainted guide 99 2 fm barcelona jaycee,POSITIVE,20,unverified claim
Humans of Kianh (🤫),"Hoi An, Central Vietnam","A merry band of kids with disability, finally getting the education and therapies they deserve. 👊🏻 to our oddball team of staff for the magic ✨",2011-11-30 12:16:45,507,680,6129,False,2020-08-16,"🇬🇧 Sadly, we - like the rest of Central Viet Nam - won't be reopening school tomorrow. But we will still have to pa… https://t.co/mJY25S5OcP",,Twitter for Android,False,unverified claim,sadly like rest central viet nam reopening school tomorrow still pa,NEGATIVE,1,unverified claim
Geraldine Lynagh,"Dublin, Ireland",News Reporter | Anchor for Virgin Media News in Ireland. All views are my own. Email geraldine.lynagh@virginmedia.ie,2010-12-14 08:10:53,5238,473,1108,False,2020-07-28,The Spanish Prime Minister has said the UK's new quarantine rules are 'unjust'. Pedro Sánchez said tourists in most… https://t.co/lA35VZbIwp,,TweetDeck,False,unverified claim,spanish prime minister said uk new quarantine rules unjust pedro nchez tourists,NEGATIVE,14,unverified claim
EMME,,She/Her/Hers. Big Brother Fanatic. Southside Serpents. Proud Ravenclaw. ACNH.,2017-08-31 10:42:05,52,325,5373,False,2020-08-08,If I see you posting pictures in groups without facemasks and social distancing...your mom's a ho #covid19,['covid19'],Twitter for Android,False,unverified claim,see posting pictures groups without facemasks social distancing mom ho,NEGATIVE,9,unverified claim
Lil’Shell,The bowels of hell,Proud Owner/Operator of this shit show. #blm #whiteshield #ladodgers #raiders #peloton #tonal #mimi,2011-11-16 04:19:14,1648,1441,25501,False,2020-08-17,All these women out here complaining about a long ass swab being put up your nose to get tested for #COVID19 . Have… https://t.co/xF7P3VXQXx,['COVID19'],Twitter for iPhone,False,unverified claim,women complaining long ass swab put nose get tested,NEGATIVE,0,unverified claim
City of Malibu,"Malibu, California","Official Twitter account of the City of Malibu. Follow us for the latest information on City news, events, projects and issues.",2011-10-11 19:48:28,13226,479,2871,True,2020-07-31,"#Malibu, the heat is on, so get ready for LAP SWIM 💧! The City continues to serve you during the pandemic. The Mali… https://t.co/hszWBVzkMl",['Malibu'],Hootsuite Inc.,False,unverified claim,heat get ready lap swim city continues serve pandemic mali,NEGATIVE,2,unverified claim
RevertingToChildhood,My happy place,"I'm just here to let off some steam.
Your opinion of me is irrelevant.
Yes, I'm a smartass. Any problem you have with my views, only encourages me. #Resist",2016-02-04 14:53:15,367,576,15079,False,2020-08-18,"@realDonaldTrump You have let 171,000 Americans die from #COVID19, in 6 months, because your inability to lead. #GFY","['COVID19', 'GFY']",Twitter Web App,False,unverified claim,let 171 000 americans die 6 months inability lead,NEGATIVE,13,unverified claim
V,"California, USA",Mother. 🌍🌱🏵,2019-06-18 03:24:49,826,1011,18521,False,2020-07-28,"Twitter keeps taking this video down.  Facebook took it down it.  

Trump Jr tweeted the video and they took it dow… https://t.co/axuMJrx4A3",,Twitter for Android,False,unverified claim,twitter keeps taking video facebook took trump jr tweeted dow,NEGATIVE,11,unverified claim
Struggle2win,"ANDHERI EAST, MUMBAI",,2019-05-14 12:29:42,19,479,2009,False,2020-08-11,@BeholdIsrael No doubt about it. We congratulate to Honorable H. E. President of Russian Federation Mr @VladPutin1… https://t.co/LR75uhW3fX,,Twitter Web App,False,unverified claim,doubt congratulate honorable h e president russian federation mr,NEGATIVE,4,unverified claim
mothers2mothers,"Cape Town, South Africa","mothers2mothers’ health workers, #MentorMothers, are on the front lines delivering health education & services to marginalised and vulnerable families.",2010-12-06 07:50:25,8946,1609,7642,False,2020-08-06,Our new 'Virtual #MentorMother Platform' - a WhatsApp-based chat bot is being rolled out in 30+ languages in 9 Afri… https://t.co/wRA9vwZ3KA,['MentorMother'],Social Media Publisher App ,False,unverified claim,new virtual platform whatsapp based chat bot rolled 30 languages 9 afri,NEGATIVE,19,unverified claim
Dr. Thomas Wilckens,"München, Bayern","MD #PrecisionMedicine leader: Changing the way we diagnose, treat and eventually prevent disease #Innovation #Healthcare #Medicine #MachineLearning #AI #omics",2013-10-22 14:46:04,3562,3135,10611,False,2020-07-27,Missed it: Did #herdimmunity' change the course of the outbreak? #coronavirus #pandemic #covid19… https://t.co/bv6x155DiY,"['herdimmunity', 'coronavirus', 'pandemic', 'covid19']",Buffer,False,unverified claim,missed change course outbreak,NEGATIVE,12,unverified claim
Engineering News,Johannesburg,"South Africa's premier source of real economy news on projects, products, personalities and technoeconomic progress. Subscribe: https://t.co/dbAHFOYWy0",2009-11-04 08:07:50,16358,1063,12,False,2020-08-13,"Opinion: My Covid-19 ordeal #covid19
https://t.co/Q8qmEShA01 https://t.co/79hf2Dr6b5",['covid19'],Hootsuite Inc.,False,unverified claim,opinion covid 19 ordeal,NEGATIVE,17,unverified claim
joe mack arthee,,Will Tweet fer food Wannabe cult leader,2016-07-29 11:00:51,5,27,2,False,2020-08-12,Russian strong man #Putin and his Chinese counterpart Ping Pong Xi have announced they got #COVID19 vaccines. In or… https://t.co/oVlpchVe0X,"['Putin', 'COVID19']",Twitter Web App,False,unverified claim,russian strong man chinese counterpart ping pong xi announced got vaccines,POSITIVE,4,unverified claim
The Insurer,"London, New York","Welcome to https://t.co/T5mRKx3MyX, where we bring you the market-leading specialty (re)insurance news, analysis and data service.",2013-06-11 15:15:17,2702,1527,421,False,2020-08-13,"COMMENT: UK industry must find a pandemic path to common ground on £6.6bn+ Pool Re future

https://t.co/MQNftjIvEw… https://t.co/b8Oj2DnobU",,Twitter Web App,False,unverified claim,comment uk industry must find pandemic path common ground 6 6bn pool future,NEGATIVE,2,unverified claim
Make #WetMarkets Great Again,,"I like #BananaRepublic, the store! not what Canada has become :-(",2016-10-04 23:13:34,397,134,8058,False,2020-08-29,"@Vansanity1 @ac_eco @MatteaMerta Viruses want to survive too, #covid19 is learning not to kill the host. People are… https://t.co/S1fXqZOLrJ",['covid19'],Twitter for iPhone,False,unverified claim,viruses want survive learning kill host people,NEGATIVE,12,unverified claim
